{
  "schema_version": "1.0",
  "generated_at": "2026-07-28T19:40:00+10:00",
  "for_date": "2026-07-29",
  "timezone": "Australia/Melbourne",
  "run": {
    "connector_calls": 22,
    "duration_ms": 94000,
    "sources": {
      "outlook_calendar": {
        "ok": true,
        "items": 22,
        "last_ok": "2026-07-28T19:38:11+10:00"
      },
      "outlook_mail": {
        "ok": true,
        "items": 90,
        "last_ok": "2026-07-28T19:38:31+10:00"
      },
      "teams": {
        "ok": true,
        "items": 15,
        "last_ok": "2026-07-28T19:38:44+10:00"
      },
      "slack": {
        "ok": true,
        "items": 38,
        "last_ok": "2026-07-28T19:39:02+10:00"
      },
      "granola": {
        "ok": true,
        "items": 8,
        "last_ok": "2026-07-28T19:39:20+10:00"
      },
      "jira": {
        "ok": true,
        "items": 168,
        "last_ok": "2026-07-28T19:39:48+10:00"
      },
      "confluence": {
        "ok": true,
        "items": 6,
        "last_ok": "2026-07-28T19:39:55+10:00"
      },
      "hubspot": {
        "ok": false,
        "error": "token expired, requires re-authorisation",
        "last_ok": null
      }
    }
  },
  "headline": {
    "text": "Five standups, then a flight to Sydney. The 2 to 4 block is the only real room you get, so spend it on the feature-flag call that has Renner stopped.",
    "anchor_item_id": "granola:synth0001#decide-1"
  },
  "day": {
    "load": "HEAVY",
    "booked_minutes": 290,
    "standup_count": 5,
    "free_minutes": 180,
    "window": {
      "start": "09:00",
      "end": "20:30"
    },
    "events": [
      {
        "id": "cal:bepoz-standup",
        "start": "09:00",
        "end": "09:30",
        "title": "Bepoz Daily Standup",
        "domain": "core-pos",
        "kind": "standup",
        "attending": "tentative",
        "organiser": false
      },
      {
        "id": "cal:focus-1",
        "start": "10:00",
        "end": "11:00",
        "title": "Focus time",
        "domain": null,
        "kind": "focus",
        "attending": "accepted",
        "organiser": true
      },
      {
        "id": "cal:insights-standup",
        "start": "11:30",
        "end": "12:00",
        "title": "Insights Daily Stand-up",
        "domain": "insights",
        "kind": "standup",
        "attending": "accepted",
        "organiser": true
      },
      {
        "id": "cal:ce-standup",
        "start": "12:00",
        "end": "12:30",
        "title": "[Standup] Customer Engagement",
        "domain": "customer-engagement",
        "kind": "standup",
        "attending": "accepted",
        "organiser": false
      },
      {
        "id": "cal:menu-standup",
        "start": "12:30",
        "end": "13:00",
        "title": "Universal Menu & Location Consolidation Standup",
        "domain": "products-app",
        "kind": "standup",
        "attending": "accepted",
        "organiser": false
      },
      {
        "id": "cal:giftcard-kickoff",
        "start": "13:00",
        "end": "13:30",
        "title": "[Insight] GiftCard Report Kick-off",
        "domain": "insights",
        "kind": "meeting",
        "attending": "tentative",
        "organiser": false
      },
      {
        "id": "cal:inv-standup",
        "start": "13:30",
        "end": "14:00",
        "title": "Inventory Daily Standup",
        "domain": "inventory",
        "kind": "standup",
        "attending": "accepted",
        "organiser": false
      },
      {
        "id": "cal:focus-2",
        "start": "14:00",
        "end": "16:00",
        "title": "Focus time",
        "domain": null,
        "kind": "focus",
        "attending": "accepted",
        "organiser": true
      },
      {
        "id": "cal:discovery",
        "start": "16:00",
        "end": "16:50",
        "title": "Product Discovery & Planning",
        "domain": "insights",
        "kind": "meeting",
        "attending": "accepted",
        "organiser": true
      },
      {
        "id": "cal:uk-pub",
        "start": "17:30",
        "end": "18:30",
        "title": "UK Pub strategy session, Swiftpos",
        "domain": "leadership",
        "kind": "meeting",
        "attending": "accepted",
        "organiser": false
      },
      {
        "id": "cal:va883",
        "start": "19:00",
        "end": "20:25",
        "title": "VA883 Melbourne to Sydney",
        "domain": null,
        "kind": "travel",
        "attending": "accepted",
        "organiser": true
      }
    ],
    "acts": [
      {
        "range": "9 AM – 2 PM",
        "text": "Five standups back to back from 11:30, with the GiftCard Report kick-off wedged in at 1. You are the organiser of the Insights one only."
      },
      {
        "range": "2 – 4 PM",
        "text": "Two hours of protected focus, the only unbroken stretch this week. Three of the five Decide items fit here."
      },
      {
        "range": "4 PM ONWARD",
        "text": "Product Discovery, then UK pub strategy with Adrian and Callum's group, then VA883 at 7. Nothing lands after 5:30."
      }
    ]
  },
  "panels": {
    "decide": {
      "cap": 5,
      "considered": 9,
      "items": [
        {
          "id": "granola:synth0002#decide-1",
          "source": "granola",
          "kind": "decision",
          "title": "Feature flag logic for the inventory V2 screen",
          "question": "Show the old product view when inventory is disabled, and the new V2 screen when enabled?",
          "why": "Old product view when inventory is off, new V2 screen when on. Raised in the Inventory standup, 27 Jul, and Renner has been stopped on it since.",
          "who_waits": [
            "Renner"
          ],
          "asked_at": "2026-07-27T03:12:00Z",
          "due": null,
          "domain": "inventory",
          "evidence": "Granola, Inventory Standup, 27 Jul",
          "evidence_url": "granola:synth0003-b551-4a86-b720-0133d071240c",
          "status": {
            "level": "critical",
            "label": "Blocking Renner"
          },
          "signals": {
            "blocks_a_named_person": true,
            "window_closes_48h": false,
            "direct_to_niel": true,
            "mission_weight": 0.8,
            "unanswered_over_48h": true,
            "recurrence": false
          },
          "score": 9.3
        },
        {
          "id": "slack:satadru-personas-20260728",
          "source": "slack",
          "kind": "decision",
          "title": "Guest versus Customer: are the persona definitions right",
          "question": "Confirm the Guest and Customer definitions, and whether a unique cross-org profile is in scope for September.",
          "why": "Marlow asked in a DM at 18:02 yesterday and flagged that a unique cross-org profile cannot land by end of September. The answer sets September scope, not just naming.",
          "who_waits": [
            "Marlow Raha"
          ],
          "asked_at": "2026-07-28T08:02:00Z",
          "due": null,
          "domain": "customer-engagement",
          "evidence": "Slack DM, 28 Jul 18:02",
          "evidence_url": null,
          "status": {
            "level": "serious",
            "label": "Scope decision"
          },
          "signals": {
            "blocks_a_named_person": true,
            "window_closes_48h": false,
            "direct_to_niel": true,
            "mission_weight": 0.8,
            "unanswered_over_48h": false,
            "recurrence": false
          },
          "score": 7.8
        },
        {
          "id": "jira:PAPP-903#design",
          "source": "granola",
          "kind": "decision",
          "title": "PAPP-903 variant selection modal redesign",
          "question": "What is the modal design that fixes child variant display without breaking layout assignment?",
          "why": "You own the rethink. Assigned in the Products App standup, 28 Jul. Still To Do, and it was due 6 July.",
          "who_waits": [],
          "asked_at": "2026-07-28T02:29:00Z",
          "due": "2026-07-06",
          "domain": "products-app",
          "evidence": "Granola, Products App Standup, 28 Jul",
          "evidence_url": "https://oolio.atlassian.net/browse/PAPP-903",
          "status": {
            "level": "warning",
            "label": "Yours, 23 days late"
          },
          "signals": {
            "blocks_a_named_person": false,
            "window_closes_48h": false,
            "direct_to_niel": true,
            "mission_weight": 0.6,
            "unanswered_over_48h": true,
            "recurrence": true
          },
          "score": 5.7
        },
        {
          "id": "granola:synth0004#decide-2",
          "source": "granola",
          "kind": "decision",
          "title": "When to slot the Northwind mapping endpoint",
          "question": "Does the two-day mapping endpoint go in now, or does the manual store ID workaround hold?",
          "why": "Roughly two days of work, and the manual store ID workaround holds until then. Left open in the Northwind Warehouse session, 28 Jul as capacity dependent, which means it waits on you.",
          "who_waits": [],
          "asked_at": "2026-07-28T04:02:00Z",
          "due": null,
          "domain": "insights",
          "evidence": "Granola, Northwind data ingestion session, 28 Jul",
          "evidence_url": "granola:synth0005-1f1f-4400-9a3e-c03bcd7b173a",
          "status": null,
          "signals": {
            "blocks_a_named_person": false,
            "window_closes_48h": false,
            "direct_to_niel": true,
            "mission_weight": 1.0,
            "unanswered_over_48h": false,
            "recurrence": false
          },
          "score": 5.2
        },
        {
          "id": "granola:synth0006#decide-3",
          "source": "granola",
          "kind": "decision",
          "title": "Online store name overrides breaking Insights reporting",